,simple,1064,Meia skate Erva cinza com folha verde musgo e bandeira da Jamaica,'-1,0,,,SKATE - MACONHA - MEIA CINZA COM FOLHA PRETA,,,taxable,,1,13,10,0,0,50,20,20,20,1,,,100,,,,,,,,,,,,,,,,,,,,,,,,,,,,,,,,,,,,,,,,,,,,,,,,,,,,,,20,,,"SKATE - MACONHA - MEIA CINZA, FOLHA VERDE MUSGO, BANDEIRA JAMAICA",,,,
 ,simple,1065,Meia skate Bandeira dos Estados Unidos,1,0,visible,"Se o American way of style falar mais alto, colorize-se com a Meia skate Bandeira dos Estados Unidos. Combine cores usando meias divertidas com estampas legais. Aproveite nossas promoções.\n[fsbglobaltext modelo=""skate""]","\n<style>.porcent{display:flex;background-color:#ddd;width:100%;height:20px;}.prcnt{background-color:#ef3f49;}</style>\n\n<h5>Estilo</h5>\n<div class=""porcent""><div class=""prcnt"" style=""flex-basis:95%;""></div></div><br>\n\n<h5>American style</h5>\n<div class=""porcent""><div class=""prcnt"" style=""flex-basis:100%;""></div></div><br>\n\n[globaltables]\n\n[palette col_num_01_free=""5"" c101=""#fafcff"" c102=""gen_desc_cores_cor_1_002%"" c103=""#061c6e"" c104=""#d4e09b"" c105=""#cbdfbd"" c106="""" col_cat_free01=""Vibrante"" col_text_free01=""The American way of style disponível para você arrasar no seu look. Combine com essas cores."" col_num_02=""5"" c201=""#FAFCFF"" c202=""#061C6E"" c203=""#0E40FA"" c204=""#0A2FBA"" c205=""#071F7B"" c206=""#"" col_cat02=""Casual"" col_text02=""Conquiste destaque apenas com seu look: combine Meia USA com a paleta de cor destacada."" col_num_03=""3"" c301=""#FAFCFF"" c302=""#930207"" c303=""#0E40FA"" c304="""" c305="""" c306="""" col_cat03=""Vibrante"" col_text03=""Vire o jogo com um estilo sofisticado usando Meia EUA com as cores escolhidas.""]",,,taxable,,1,9,3,0,0,61,,,,1,,,16,"Lifestyle > Divertidas, Lifestyle > Tendências",Meia skate,,"https://crossfeet.com.br/wp-content/uploads/2019/09/Meia-longa-Estados-Unidos-USA-meias-divertidasFSB.jpg, https://crossfeet.com.br/wp-content/uploads/2019/09/Meia-estados-unidos-EUA-USA-meias-skate-FSB.jpg",1,5,,,,,,,,,10,"{""Cores"":{""name"":""Cores"",""type"":""color"",""terms"":{""Azul"":{""name"":""Azul"",""color"":""#0000ff"",""image"":"""",""show_tooltip"":"""",""tooltip_text"":"""",""tooltip_image"":"""",""image_size"":""""},""Vermelho"":{""name"":""Vermelho"",""color"":""#ff0000"",""image"":"""",""show_tooltip"":"""",""tooltip_text"":"""",""tooltip_image"":"""",""image_size"":""""},""Branco"":{""name"":""Branco"",""color"":""#ffffff"",""image"":"""",""show_tooltip"":"""",""tooltip_text"":"""",""tooltip_image"":"""",""image_size"":""""}}}}",Modelo,Sublimada,1,1,Cores,"Azul, Vermelho, Branco",1,1,default,et_no_sidebar,off,,BB|Divi|3.22.5,,,hourly,"Meia Bandeira dos Estados Unidos,meia bandeira de paises,meias EUA,meia USA,meias estampadas,meias engraçadas,meias para ciclismo,meia cano alto,meias outlet rj,meias para casamento,meias FSB,FSB meias,meias cano médio femininas,meias coloridasfemininas,meias personalizadas",Meia Bandeira dos Estados Unidos com preço de atacado na meias FSB ✓ Meias cano alto e sublimadas ✓ pagamento seguro ✓ garanta a sua!,Meia Bandeira dos Estados Unidos - Meias FSB,,,,,,,,,Tipo de combinação,"Casual, Vibrante",1,1,,,,,,Observação pode ser adicionada aqui,,,,SKATE - BANDEIRA ESTADOS UNIDOS,,,,
,simple,1066,Meia skate Erva branca com folha preta (ESTOQUE ERRADO),'-1,0,,,SKATE - BANDEIRA ESTADOS UNIDOS,,,taxable,,1,17,10,0,0,50,20,20,20,1,,,100,,,,,,,,,,,,,,,,,,,,,,,,,,,,,,,,,,,,,,,,,,,,,,,,,,,,,,10,,,SKATE - MEIA BRANCA COM FOLHA DA MACONHA PRETA,,,,
,,1067,"SKATE - MEIA CINZA, ESTRELAS BRANCAS, LISTRAS BRANCO/CINZA",,,,,,,,,,,1,,,,,,,,,,,,,,,https://crossfeet.com.br/wp-content/uploads/2019/08/1067.jpg,,,,,,,,,,,,,,,,,,,,,,,,,,,,,,,,,,,,,,,,,,,,,,,,,,,,,"SKATE - MEIA CINZA, ESTRELAS BRANCAS, LISTRAS BRANCO/CINZA",,,,
,simple,1068,Meia skate branca lines vermelha amarela e everde (PULADO),'-1,0,,,"SKATE - MEIA CINZA, ESTRELHAS BRANCAS, LISTRAS BRANCO/CINZA",,,taxable,,1,21,10,0,0,50,20,20,20,1,,,100,,,,,,,,,,,,,,,,,,,,,,,,,,,,,,,,,,,,,,,,,,,,,,,,,,,,,,,,,SKATE - MEIA BRANCA LISTA VERMELHA AMARELA E VERDE,,,,
,simple,1069,Meia skate cinza claro com caveiras pretas pequenas,1,0,visible,"Triângulo, retângulo, quadrado.. Observamos pela Meia cinza com caveiras pretas que um desenho de elite faz a diferença. Adicione mais estampas alternativas ao seu guarda-roupa agora em meias geek e nerd com estampas de elite. Compre agora e ganhe desconto ao comprar várias unidades.\n[fsbglobaltext modelo=""skate""]","\n<style>.porcent{display:flex;background-color:#ddd;width:100%;height:20px;}.prcnt{background-color:#ef3f49;}</style>\n\n<h5>Estilo</h5>\n<div class=""porcent""><div class=""prcnt"" style=""flex-basis:90%;""></div></div><br>\n\n<h5>Conforto</h5>\n<div class=""porcent""><div class=""prcnt"" style=""flex-basis:100%;""></div></div><br>\n\n[globaltables]\n\n[palette col_num_01_free=""4"" c101=""#575755"" c102=""gen_desc_cores_cor_1_002%"" c103=""#E3E3DE"" c104=""#A3A3A0"" c105="""" c106="""" col_cat_free01=""Neutro"" col_text_free01=""A combinação mais moderna e exclusiva de ""não-cores"" para você usar com Meia da caveira e ter um estilo esquelético."" col_num_02=""4"" c201=""#575755"" c202=""#100f15"" c203=""#8b9556"" c204=""#abb557"" c205=""#bed558"" c206=""#"" col_cat02=""Casual"" col_text02=""Junte a Meia da caveira com as cores selecionadas e crie um look agradável e harmonioso. "" col_num_03=""5"" c301=""#575755"" c302=""#100f15"" c303=""#2e1f27"" c304=""#dd7230"" c305=""#f4c95d"" c306="""" col_cat03=""Casual"" col_text03=""Combine Meia da caveira com tons de e garanta um visual que valoriza seu estilo e personalidade.""]",,,taxable,,1,23,3,0,0,61,,,,1,,,16,"Lifestyle > Divertidas, Clássicos > Estampadas",Meia skate,,https://crossfeet.com.br/wp-content/uploads/2019/09/meia-caveira-cinza-com-caveira-preta.jpg,1,5,,,,,,,,,10,"{""Cores"":{""name"":""Cores"",""type"":""color"",""terms"":{""Cinza"":{""name"":""Cinza"",""color"":""#808080"",""image"":"""",""show_tooltip"":"""",""tooltip_text"":"""",""tooltip_image"":"""",""image_size"":""""}}}}",Modelo,Skate,1,1,Cores,Cinza,1,1,default,et_no_sidebar,off,,BB|Divi|3.22.5,,,hourly,"Meia cinza com caveiras pretas,meia com caveiras,meia cinza,FSB,meias cano médio,meias engraçadas,meias para academia,meia personalizada,meias menor preço,clube de meias,meias FSB,FSB meias,meias cano médio,meias sublimadasfemininas,meias para academia masculinas",Meia cinza com caveiras pretas em Outlet na meias FSB ✓ Meias divertidas ✓ com até 70%OFF ✓ pagamento parcelado ✓ Peça já!,Meia cinza com caveiras pretas - Comprar agora - Meias FSB,,,,,,,,,Tipo de combinação,"Casual, Neutro",1,1,,,,,,Observação pode ser adicionada aqui,,,,"SKATE - MEIA CINZA CLARO, CAVEIRA PRETAS PEQUENAS",,,,
,simple,1069A,Meia skate cinza chumbo com caveiras pretas pequenas,1,0,visible,"\n[fsbglobaltext modelo=""skate""]","\n<style>.porcent{display:flex;background-color:#ddd;width:100%;height:20px;}.prcnt{background-color:#ef3f49;}</style>\n\n<h5>Estilo</h5>\n<div class=""porcent""><div class=""prcnt"" style=""flex-basis:90%;""></div></div><br>\n\n<h5>Conforto</h5>\n<div class=""porcent""><div class=""prcnt"" style=""flex-basis:100%;""></div></div><br>\n\n[globaltables]\n\n[palette col_num_01_free=""4"" c101=""#575755"" c102=""gen_desc_cores_cor_1_002%"" c103=""#E3E3DE"" c104=""#A3A3A0"" c105="""" c106="""" col_cat_free01=""Neutro"" col_text_free01=""A combinação mais exclusiva  para você usar com Meia da caveira e ter um estilo matador."" col_num_02=""4"" c201=""#575755"" c202=""#100f15"" c203=""#8b9556"" c204=""#abb557"" c205=""#bed558"" c206=""#"" col_cat02=""Casual"" col_text02=""Unaa Meia da caveira com as cores recomndadas e crie um look agradável e harmonioso. "" col_num_03=""5"" c301=""#575755"" c302=""#100f15"" c303=""#2e1f27"" c304=""#dd7230"" c305=""#f4c95d"" c306="""" col_cat03=""Casual"" col_text03=""Rescucite até defunto combinando a meia e seu look com as cores indicadas.""]",,,taxable,,1,16,3,0,0,61,,,,1,,,16,"Lifestyle > Divertidas, Clássicos > Estampadas",Meia skate,,https://crossfeet.com.br/wp-content/uploads/2019/09/meia-caveira-cinza-com-caveira-preta-1.jpg,1,5,,,,,,,,,10,"{""Cores"":{""name"":""Cores"",""type"":""color"",""terms"":{""Cinza"":{""name"":""Cinza"",""color"":""#808080"",""image"":"""",""show_tooltip"":"""",""tooltip_text"":"""",""tooltip_image"":"""",""image_size"":""""}}}}",Modelo,Skate,1,1,Cores,Cinza,1,1,default,et_no_sidebar,off,,BB|Divi|3.22.5,,,hourly,"Meia cinza chumbo com caveiras pretas,meia caveira,meias estmpadas,FSB,meias cano médio,meias sublimadas,meias para academia,meia engraçada,meias outlet,clube FSB,meias FSB,FSB meias,meias cano alto,meias coloridas,meias para bike masculinas",Meia cinza chumbo com caveiras pretas com menor preço na meias FSB ✓ Meias para sair com amigos ✓ Outlet ✓ pagamento seguro ✓ Peça já!,Meia cinza chumbo com caveiras pretas - Meias FSB,,,,,,,,,Tipo de combinação,"Casual, Neutro",1,1,,,,,,Observação pode ser adicionada aqui,,,,"SKATE - MEIA CINZA CHUMBO , CAVEIRAS PRETA PEQUENAS",,,,
,,1070,"SKATE - MEIA PRETA, LISTRAS FINAS VERDE, AMARELO, VERMELHO ALIEN VERDE",,,,,,,,,,,4,,,,,,,,,,,,,,,,,,,,,,,,,,,,,,,,,,,,,,,,,,,,,,,,,,,,,,,,,,,,,,,,,,,,"SKATE - MEIA PRETA, LISTRAS FINAS VERDE, AMARELO, VERMELHO ALIEN VERDE",,,,
,,1071,"SKATE - MEIA BRANCA, LISTRAS FINAS PRETAS/BRANCAS, LISTRAS AZUL/BRANCA PÉS",,,,,,,,,,,2,,,,,,,,,,,,,,,,,,,,,,,,,,,,,,,,,,,,,,,,,,,,,,,,,,,,,,,,,,,,,,,,,,,,"SKATE - MEIA BRANCA, LISTRAS FINAS PRETAS/BRANCAS, LISTRAS AZUL/BRANCA PÉS",,,,
,,1072,"SKATE - MEIA PRETA, CAVEIRA BRANCA",,,,,,,,,,,2,,,,,,,,,,,,,,,https://crossfeet.com.br/wp-content/uploads/2019/08/1072.jpg,,,,,,,,,,,,,,,,,,,,,,,,,,,,,,,,,,,,,,,,,,,,,,,,,,,,,"SKATE - MEIA PRETA, CAVEIRA BRANCA",,,,
,simple,1073,"SKATE - MEIA PRETA, CAVEIRA CINZA ESCURO",'-1,0,,,"SKATE - MEIA PRETA, CAVEIRA BRANCA",,,taxable,,1,2,10,0,0,50,20,20,20,1,,,100,,,,https://crossfeet.com.br/wp-content/uploads/2019/08/1073.jpg,,,,,,,,,,,,,,,,,,,,,,,,,,,,,,,,,,,,,,,,,,,,,,,,,,,,,"SKATE - MEIA PRETA, CAVEIRA CINZA ESCURO",,,,
,simple,1073A,"SKATE - MEIA BRANCA, CAVEIRA MÉDIA PRETA, LISTRAS VERMELHAS",'-1,0,,,"SKATE - MEIA PRETA, CAVEIRA CINZA ESCURO",,,taxable,,1,1,10,0,0,50,20,20,20,1,,,100,,,,,,,,,,,,,,,,,,,,,,,,,,,,,,,,,,,,,,,,,,,,,,,,,,,,,,,,,"SKATE - MEIA BRANCA, CAVEIRA MÉDIA PRETA, LISTRAS VERMELHAS",,,,
,,1074,Meia skate preta lines Bandeira da Jamaica (Pulado),,,,,,,,,,,27,,,,,,,,,,,,,,,,,,,,,,,,,,,,,,,,,,,,,,,,,,,,,,,,,,,,,,,,,,,,,,,,,,,,SKATE - MEIA PRETA  LISTRAS BANDEIRA DA JAMAICA,,,,
,simple,1075,Meia skate branca lines cinza/verde marcante,1,0,visible,"Sete e meia, um senhor de meia altura que estava comendo meia pêra afirmou sem meias mentiras ou meias verdades: a Meia branca lines cinza e verde marcante completa seu look. Para evitar um visual meia tigela meias divertidas, estilosas e de algodão. Garanta já antes que o tempo acabe.\n[fsbglobaltext modelo=""skate""]","\n<style>.porcent{display:flex;background-color:#ddd;width:100%;height:20px;}.prcnt{background-color:#ef3f49;}</style>\n\n<h5>Estilo</h5>\n<div class=""porcent""><div class=""prcnt"" style=""flex-basis:90%;""></div></div><br>\n\n<h5>Conforto</h5>\n<div class=""porcent""><div class=""prcnt"" style=""flex-basis:100%;""></div></div><br>\n\n[globaltables]\n\n[palette col_num_01_free=""4"" c101=""#F7F7F7"" c102=""gen_desc_cores_cor_1_002%"" c103=""#E4F31C"" c104=""#DCD6D6"" c105="""" c106="""" col_cat_free01=""Vibrante"" col_text_free01=""Uma combinação de alto contraste para quem tem estilo marcante. Utilize-a com saberdoria."" col_num_02=""4"" c201=""#f7f7f7"" c202=""#0c0809"" c203=""#e4f31c"" c204=""#361134"" c205=""#b0228c"" c206=""#"" col_cat02=""Vibrante"" col_text02=""Vamos espantar a mesmice com um look despojado? Escolha a cor principal e combine as demais atenciosamente."" col_num_03=""5"" c301=""#f7f7f7"" c302=""#e4f31c"" c303=""#f7c59f"" c304=""#2a324b"" c305=""#767b91"" c306="""" col_cat03=""Vibrante"" col_text03=""Inove no visual utilizando Meia lines e combinando com as cores escolhidas. Ganhe destaque em qualquer lugar.""]",,,taxable,,1,26,3,0,0,61,,,,1,,,16,"Clássicos > Texturas, Clássicos > Casual",Meia skate,,https://crossfeet.com.br/wp-content/uploads/2019/09/meia-verde-marca-texto-meias-FSB.jpg,1,5,,,,,,,,,10,"{""Cores"":{""name"":""Cores"",""type"":""color"",""terms"":{""Branco"":{""name"":""Branco"",""color"":""#fffffff"",""image"":"""",""show_tooltip"":"""",""tooltip_text"":"""",""tooltip_image"":"""",""image_size"":""""}}}}",Modelo,Skate,1,1,Cores,Branco,1,1,default,et_no_sidebar,off,,BB|Divi|3.22.5,,,hourly,"Meia branca com listra cinza e verde marcante,meias lsitradas,meias divertidas,meias coloridas,meias FSB,meias estampadas,meias coloridas,meias para maratona,meia divertida,meias promoção,meias para noivado,meias FSB,FSB meias,meias cano médio,meias esportivasfemininas,meias para skate",Meia branca com listra cinza e verde marcante com menor preço na meias FSB ✓ até 50%OFF ✓ pagamento seguro ✓ garanta a sua!,Meia branca com listra cinza e verde marcante - Meias FSB,,,,,,,,,Tipo de combinação,Vibrante,1,1,,,,,,Observação pode ser adicionada aqui,,,,"SKATE - BRANCA, LISTRA CINZA/VERDE MARCA TEXTO",,,,
,simple,1076,Meia skate cinza com 13 preto,1,0,visible,"A Meia cinza com 13 preto já salvou relacionamentos, famílias e agora vai salvar o seu look. Salve seu dia usando meias engraçadas, estilosas confortáveis e de elite. Confira nossos melhores preços e veja nossas fotos.\n[fsbglobaltext modelo=""skate""]","\n<style>.porcent{display:flex;background-color:#ddd;width:100%;height:20px;}.prcnt{background-color:#ef3f49;}</style>\n\n<h5>Estilo</h5>\n<div class=""porcent""><div class=""prcnt"" style=""flex-basis:90%;""></div></div><br>\n\n<h5>Conforto</h5>\n<div class=""porcent""><div class=""prcnt"" style=""flex-basis:100%;""></div></div><br>\n\n[globaltables]\n\n[palette col_num_01_free=""5"" c101=""#b8b6a9"" c102=""gen_desc_cores_cor_1_002%"" c103=""#ef6461"" c104=""#e4b363"" c105=""#e8e9eb"" c106="""" col_cat_free01=""Casual"" col_text_free01=""Tenha 13 motivos para você combinar o seu look com a meia 3: utilize as cores selecionadas."" col_num_02=""5"" c201=""#b8b6a9"" c202=""#090a0e"" c203=""#7b886f"" c204=""#feffa5"" c205=""#ffa0ac"" c206=""#"" col_cat02=""Casual"" col_text02=""Vire o jogo com um look de atitude utilizando Meia 13 com as cores destacadas."" col_num_03=""5"" c301=""#b8b6a9"" c302=""#090a0e"" c303=""#f2d7ee"" c304=""#a5668b"" c305=""#69306d"" c306="""" col_cat03=""Vibrante"" col_text03=""Combine estilo ao seu visual combinando Meia 13 essas cores de alta harmonia.""]",,,taxable,,1,24,3,0,0,61,,,,1,,,16,Clássicos > Casual,Meia skate,,https://crossfeet.com.br/wp-content/uploads/2019/09/meia-cinza-13-preto-meias-FSB1.jpg,1,5,,,,,,,,,10,"{""Cores"":{""name"":""Cores"",""type"":""color"",""terms"":{""Cinza"":{""name"":""Cinza"",""color"":""#808080"",""image"":"""",""show_tooltip"":"""",""tooltip_text"":"""",""tooltip_image"":"""",""image_size"":""""}}}}",Modelo,Skate,1,1,Cores,Cinza,1,1,default,et_no_sidebar,off,,BB|Divi|3.22.5,,,hourly,"Meia cinza com 13 preto,meia,meias cano médio,meias engraçadas,meias para academia,meia divertida,meias outlet,clube FSB,meias FSB,FSB meias,meias cano médio,meias coloridas masculinas,meias para Crossfit femininas",Meia cinza com 13 preto em Outlet na meias FSB ✓ Meias casuais ✓ com até 70% OFF ✓ pagamento parcelado ✓ compre agora!,Meia cinza com 13 preto - Meias casuais FSB,,,,,,,,,Tipo de combinação,"Casual, Vibrante",1,1,,,,,,Observação pode ser adicionada aqui,,,,SKATE - MEIA CINZA COM 13 PRETO,,,,
,simple,1077,Meia skate preta square and lines azul e amarelo,1,0,visible,"Comprovado que atletas que utilizam a Meia preta square and lines azul e amarelo alavancam em 400% o seu rendimento e o estilo na hora de praticar sua atividade. Traga diversão ao seu treinos usando meias crossfit, divertidas com muito estilo e conforto. Garanta já antes que o estoque acabe.\n[fsbglobaltext modelo=""skate""]","\n<style>.porcent{display:flex;background-color:#ddd;width:100%;height:20px;}.prcnt{background-color:#ef3f49;}</style>\n\n<h5>Estilo</h5>\n<div class=""porcent""><div class=""prcnt"" style=""flex-basis:90%;""></div></div><br>\n\n<h5>Conforto</h5>\n<div class=""porcent""><div class=""prcnt"" style=""flex-basis:100%;""></div></div><br>\n\n[globaltables]\n\n[palette col_num_01_free=""4"" c101=""#0F1013"" c102=""gen_desc_cores_cor_1_002%"" c103=""#166C7F"" c104=""#D1C645"" c105="""" c106="""" col_cat_free01=""Vibrante"" col_text_free01=""Demonstre sua paixão pelas linhas e formas combinando a meia square lines com as cores selecionadas."" col_num_02=""4"" c201=""#0f1013"" c202=""#166c7f"" c203=""#d1c645"" c204=""#d7263d"" c205=""#f46036"" c206=""#"" col_cat02=""Vibrante"" col_text02=""A combinação perfeita para quem tem atitude e quer expressar seu visual com contraste. Ideal para festas e locais agitados."" col_num_03=""5"" c301=""#0f1013"" c302=""#166c7f"" c303=""#d1c645"" c304=""#004e64"" c305=""#00a5cf"" c306="""" col_cat03=""Vibrante"" col_text03=""Arrase com Meia lines! Utilize com as cores recomendadas em baladas, boates e outras ocasiões.""]",,,taxable,,1,5,3,0,0,61,,,,1,,,16,"Clássicos > Texturas, Clássicos > Casual",Meia skate,,"https://crossfeet.com.br/wp-content/uploads/2019/09/Meia-preta-square-and-lines-azul-e-amarelo-meias-FSB.jpg, https://crossfeet.com.br/wp-content/uploads/2019/09/Meia-preta-squares-and-lines-meias-com-texxtura-FSB.jpg",1,5,,,,,,,,,10,"{""Cores"":{""name"":""Cores"",""type"":""color"",""terms"":{""Preto"":{""name"":""Preto"",""color"":""#000000"",""image"":"""",""show_tooltip"":"""",""tooltip_text"":"""",""tooltip_image"":"""",""image_size"":""""}}}}",Modelo,Sublimada,1,1,Cores,Preto,1,1,default,et_no_sidebar,off,,BB|Divi|3.22.5,,,hourly,"Meia preta square and lines azul e amarelo,meia com quadrados,meias listradas,meias casual,FSB,meias cano alto,meias sublimadas,meias para corrida,meia divertida,meias outlet sp,clube de meias,meias FSB,FSB meias,meias estampadas,meias engraçadas masculinas,meias para ciclismo",Meia preta square and lines azul e amarelo em Outlet na meias FSB ✓ Meias cano alto e sublimadas ✓ pagamento seguro ✓ compre agora!,Meia preta square and lines azul e amarelo - Meias FSB,,,,,,,,,Tipo de combinação,Vibrante,1,1,,,,,,Observação pode ser adicionada aqui,,,,"SKATE - MEIA PRETA, QUADRADINHOS BRANCOS, LISTRAS AZUL/AMARELO",,,,
,simple,1078,Meia branca quadradinhos e listras cinza/vermelho,1,0,visible,"Do trabalho até o treino crossfit. a Meia branca quadradinhos e listras cinza/vermelho te deixa em prontidão para qualquer ocasião. Inove seu visual agora com meias cano médio, personalizadas e coloridas com muita atitude e do seu gosto. Aproveite nossos preços promocionais e confira nossas coleções.\n[fsbglobaltext modelo=""skate""]","\n<style>.porcent{display:flex;background-color:#ddd;width:100%;height:20px;}.prcnt{background-color:#ef3f49;}</style>\n\n<h5>Estilo</h5>\n<div class=""porcent""><div class=""prcnt"" style=""flex-basis:70%;""></div></div><br>\n\n[globaltables]\n\n[palette col_num_01_free=""4"" c101=""#587AC7"" c102=""gen_desc_cores_cor_1_002%"" c103=""#7B4346"" c104=""#C7444B"" c105="""" c106="""" col_cat_free01=""Casual"" col_text_free01=""Utilize com a a Meia branca quadradinhos e listras cinza/vermelho no visual em lugares casuais, estudos em geral, logo ali, etc..."" col_num_02=""4"" c201=""#84091E"" c202=""#D4D8E1"" c203=""#039111"" c204="""" c205="""" c206=""#"" col_cat02=""Casual"" col_text02=""Junte a com as cores selecionadas e crie um estilo jovial em inúmeras ocasiões."" col_num_03=""3"" c301=""#730B0B"" c302=""#D4D8E1"" c303=""#52555A"" c304="""" c305="""" c306="""" col_cat03=""Vibrante"" col_text03=""Junte a a Meia branca quadradinhos e listras cinza/vermelho com as cores selecionadas e crie um look incrível.""]",,,taxable,,1,10,3,0,0,61,,,,1,,,16,"Clássicos > Casual, Clássicos > Texturas",Meia ECLS,,"https://crossfeet.com.br/wp-content/uploads/2019/08/Meia-branca-quadradinhos-e-listras-cinza-vermelho-meias-preço-de-black-friday-FSB.jpg, https://crossfeet.com.br/wp-content/uploads/2019/08/Meia-branca-quadradinhos-e-listras-cinza-vermelho-meias-cano-alto-FSB.jpg, https://crossfeet.com.br/wp-content/uploads/2019/08/Meia-branca-quadradinhos-e-listras-cinza-vermelho-meias-casual-FSB.jpg, https://crossfeet.com.br/wp-content/uploads/2019/08/Meia-branca-quadradinhos-e-listras-cinza-vermelho-meias-menor-preço-femininas-FSB.jpg",1,5,,,,,,,,,10,"{""Cores"":{""name"":""Cores"",""type"":""color"",""terms"":{""Branco"":{""name"":""Branco"",""color"":""#ffffff"",""image"":"""",""show_tooltip"":"""",""tooltip_text"":"""",""tooltip_image"":"""",""image_size"":""""},""Cinza"":{""name"":""Cinza"",""color"":""#808080"",""image"":"""",""show_tooltip"":"""",""tooltip_text"":"""",""tooltip_image"":"""",""image_size"":""""}}}} ",Modelo,Esporte/Casual/Lifestyle,1,1,Cores,"Branco, Cinza",1,1,default,et_no_sidebar,off,,BB|Divi|3.22.5,,,hourly,"Meia branca quadradinhos e listras cinza/vermelho,meias casuais,FSBmeias divertidas,meias coloridas,meias para ciclismo,meia estilosa,meias Black Friday,meias para aniversário,meias FSB,FSB meias,meias divertidas,meias engraçadasfemininas,meias para academia femininas","Incrível! Meia branca quadradinhos e listras cinza/vermelho - com preço de atacado na meias FSB ✓ Meias para trabalho nas versões masculina, feminina e infantil ✓ garanta a sua!",Meia branca quadradinhos e listras cinza/vermelho - Meias FSB,,,,,,,,,Tipo de combinação,"Casual, Vibrante",1,1,,,,,,Observação pode ser adicionada aqui,,,,"SKATE - MEIA BRANCA, QUADRADINHOS CINZA ESCURO, LISTRAS CINZA/VERMELHO",,,,
,simple,1079,"SKATE - MEIA CINZA MESCLA, LOSANGO 3D, PUNHO PRETO",'-1,0,,,"SKATE - MEIA BRANCA, QUADRADINHOS CINZA ESCURO, LISTRAS CINZA/VERMELHO",,,taxable,,1,1,10,0,0,50,20,20,20,1,,,100,,,,https://crossfeet.com.br/wp-content/uploads/2019/08/1079.jpg,,,,,,,,,,,,,,,,,,,,,,,,,,,,,,,,,,,,,,,,,,,,,,,,,,10,,,"SKATE - MEIA CINZA MESCLA, LOSANGO 3D, PUNHO PRETO",,,,
,simple,1080,Meia branca quadradinhos e listras cinza/vermelho,1,0,visible,"A meia arco-íris preta horizontal já salvou relacionamentos, famílias e agora vai salvar o seu look. Salve seu dia com meias divertidas e coloridas para você criar peças exclusivas e incríveis. Aproveite nossas ofertas.\n[fsbglobaltext modelo=""ELCS""]","\n<style>.porcent{display:flex;background-color:#ddd;width:100%;height:20px;}.prcnt{background-color:#ef3f49;}</style>\n\n<h5>Estilo</h5>\n<div class=""porcent""><div class=""prcnt"" style=""flex-basis:95%;""></div></div><br>\n\n<h5>Orgulho</h5>\n<div class=""porcent""><div class=""prcnt"" style=""flex-basis:100%;""></div></div><br>\n\n[globaltables]\n\n[palette col_num_01_free=""6"" c101=""#2C2D4B"" c102=""gen_desc_cores_cor_1_002%"" c103=""#094D4C"" c104=""#970512"" c105=""#EBAF7B"" c106=""#B8A80D"" col_cat_free01=""Vibrante"" col_text_free01=""Combine sua meia com essas cores. Escolha algumas se desejar."" col_num_02=""6"" c201=""#1C171D"" c202=""#B73DCF"" c203=""#836833"" c204=""#CF9628"" c205=""#33835C"" c206=""##28CF7E"" col_cat02=""Vibrante"" col_text02=""Demonstre seu orgulho e combine seu look com as cores selecionadas."" col_num_03=""6"" c301=""#2C2D4B"" c302=""#ABFD00"" c303=""#1920FD"" c304=""#B13721"" c305=""#FD2700"" c306=""#82B121"" col_cat03=""Vibrante"" col_text03=""A combinação de cor mais democrática: utilize-a no seu visual.""]",,,taxable,,1,13,3,0,0,61,,,,1,,,16,"Lifestyle > Divertidas, Clássicos > Coloridas",Meia ECLS,,"https://crossfeet.com.br/wp-content/uploads/2019/08/meia-arco-iris-preta-horizontal-meias-coloridas-FSB.jpg, https://crossfeet.com.br/wp-content/uploads/2019/08/meia-arco-iris-preta-horizontal-meias-academia-FSB.jpg, https://crossfeet.com.br/wp-content/uploads/2019/08/meia-arco-iris-preta-horizontal-meias-orgulho-FSB.jpg",1,5,,,,,,,,,10,"{""Cores"":{""name"":""Cores"",""type"":""color"",""terms"":{""Preto"":{""name"":""Preto"",""color"":""#000000"",""image"":"""",""show_tooltip"":"""",""tooltip_text"":"""",""tooltip_image"":"""",""image_size"":""""}}}} ",Modelo,Sublimada,1,1,Cores,Preto,1,1,default,et_no_sidebar,off,,BB|Divi|3.22.5,,,hourly,"Meia arco íris preta horizontal,Meias LGBT,Meias arco iris,Meias rainbow,FSB,meias cano alto,meias engraçadas,meias para treino Crossfit,meia estampada,meias outlet rj,clube FSB meias,meias FSB,FSB meias,meias cano alto masculinas,meias engraçadas masculinas,meias para patins masculinas","Wow! Meia arco íris preta horizontal - com preço de atacado na meias FSB ✓ Meias para aniversário nas versões masculina, feminina e infantil ✓ comprar agora!",Meia arco íris preta horizontal - Meias coloridas FSB,,,,,,,,,Tipo de combinação,Vibrante,1,1,,,,,,Observação pode ser adicionada aqui,,,,"SKATE - MEIA PRETA, ARCO IRIS , HORIZONTAL",,,,
,simple,1081,"SKATE - ARCO IRIS BRANCO , HORIZONTAL",'-1,0,,,SKATE - ARCO IRIS PRETO,,,taxable,,1,0,10,0,0,50,20,20,20,1,,,100,,,,,,,,,,,,,,,,,,,,,,,,,,,,,,,,,,,,,,,,,,,,,,,,,,,,,,10,15,,"SKATE - ARCO IRIS BRANCO , HORIZONTAL",,,,
,simple,1082,"SKATE - ARCO IRIS CINZA MESCLA , HORIZONTAL",'-1,0,,,SKATE - ARCO IRIS BRANCO,,,taxable,,1,1,10,0,0,50,20,20,20,1,,,100,,,,https://crossfeet.com.br/wp-content/uploads/2019/08/1082.jpg,,,,,,,,,,,,,,,,,,,,,,,,,,,,,,,,,,,,,,,,,,,,,,,,,,10,10,,"SKATE - ARCO IRIS CINZA MESCLA , HORIZONTAL",,,,
,simple,1083,Meia skate vermelha bold lines verde musgo,'-1,0,,,SKATE - ARCO IRIS CINZA MESCLA,,,taxable,,1,6,10,0,0,50,20,20,20,1,,,100,,,,https://crossfeet.com.br/wp-content/uploads/2019/08/1083.jpg,,,,,,,,,,,,,,,,,,,,,,,,,,,,,,,,,,,,,,,,,,,,,,,,,,10,15,,"SKATE - MEIA VERMELHA, LISTRA GROSSA, VERDE MUSGO",,,,
